field_source_collection,field_source_collection_id,field_source_repository,field_source_citation,field_related_title_part_of,Status,mods_relatedItem_host_titleInfo_title_ms,mods_relatedItem_host_originInfo_dateCreated_ms,mods_relatedItem_host_identifier_ms,mods_relatedItem_host_identifier_local-asc_ms,mods_relatedItem_host_note_prefercite_ms,mods_relatedItem_note_prefercite_ms
"Frank E. Bolden Papers, 1930-1967",AIS.2008.05,"Archives & Special Collections, University of Pittsburgh Library System","Frank E. Bolden Papers, 1930-1967, AIS.2008.05, Archives & Special Collections, University of Pittsburgh Library System",,,"Frank E. Bolden Papers\, 1930-1967",,AIS.2008.05,,,"Frank E. Bolden Papers\, 1930-1967\, AIS.2008.05\, Archives & Special Collections\, University of Pittsburgh Library System"
"Oscar Knight Diaries, 1898-1900",AIS.2021.14,"Archives & Special Collections, University of Pittsburgh Library System","Oscar Knight Diaries, 1898-1900, AIS.2021.14, Archives & Special Collections, University of Pittsburgh Library System",,,Oscar Knight Diaries,,AIS.2021.14,,,"Oscar Knight Diaries\, 1898-1900\, AIS.2021.14\, Archives & Special Collections\, University of Pittsburgh Library System"
"Thorn Hill School for Boys Records, 1915-1965",MSS 763,"Detre Library & Archives, Heinz History Center","Thorn Hill School for Boys Records, 1915-1965, MSS 763, Detre Library & Archives, Heinz History Center",,,"Thorn Hill School for Boys Records\, 1915-1965",,MSS 763,,,"Thorn Hill School for Boys Records\, 1915-1965\, MSS 763\, Detre Library & Archives\, Heinz History Center"
"St. Luke's Lutheran Church (West View, Pa.) Records, 1907-2007",MSS 1237,"Detre Library & Archives, Heinz History Center","St. Luke's Lutheran Church (West View, Pa.) Records, 1907-2007, MSS 1237, Detre Library & Archives, Heinz History Center",,,"St. Luke's Lutheran Church (West View\, Pa.) Records\, 1907-2007\, MSS 1237\, Detre Library & Archives\, Heinz History Center",,MSS 1237,,,"St. Luke's Lutheran Church (West View\, Pa.) Records\, 1907-2007\, MSS 1237\, Detre Library & Archives\, Heinz History Center"
"St. Luke's Lutheran Church (West View, Pa.) Records, 1907-2007",MSS 1237,"Detre Library & Archives, Heinz History Center","St. Luke's Lutheran Church (West View, Pa.) Records, 1907-2007, MSS 1237, Detre Library & Archives, Heinz History Center",,,"St. Luke's Lutheran Church (West View\, Pa.) Records\, 1907-2007\, MSS 1237\, Detre Library & Archives\, Heinz History Center",,MSS 1237,,"St. Luke's Lutheran Church (West View\, Pa.) Records\, 1907-2007\, MSS 1237\, Detre Library & Archives\, Heinz History Center",
"Thorn Hill School for Boys Records, 1915-1965",MSS 763,"Detre Library & Archives, Heinz History Center","Thorn Hill School for Boys Records, 1915-1965, MSS 763, Detre Library & Archives, Heinz History Center",,,"Thorn Hill School for Boys Records\, 1915-1965",,MSS_763,,,"Thorn Hill School for Boys Records\, 1915-1965\, MSS 763\, Detre Library & Archives\, Heinz History Center"
"Humane Animal Rescue Records and Photographs, 1874-2019",MSS 1244,"Detre Library & Archives, Heinz History Center","Humane Animal Rescue Records and Photographs, 1874-2019, MSS 1244, Detre Library & Archives, Heinz History Center",,,"Humane Animal Rescue Records and Photographs\, 1874-2019\, MSS 1244\, Detre Library & Archives\, Heinz History Center",,MSS 1244,,,"Humane Animal Rescue Records and Photographs\, 1874-2019\, MSS 1244\, Detre Library & Archives\, Heinz History Center"
"Rudolf Carnap Papers, 1891-2007",ASP.1974.01,"Archives of Scientific Philosophy, Archives & Special Collections, University of Pittsburgh Library System","Rudolf Carnap Papers, 1891-2007, ASP.1974.01, Archives of Scientific Philosophy, Archives & Special Collections, University of Pittsburgh Library System",,,Rudolf Carnap Papers,,ASP.1974.01,,,"Rudolf Carnap Papers\, 1905-1970\, ASP.1974.01\, Archives of Scientific Philosophy\, Archives & Special Collections\, University of Pittsburgh Library System"
"Darlington Family Papers, 1753-1921",DAR.1925.01,"Darlington Collection, Archives & Special Collections, University of Pittsburgh Library System","Darlington Family Papers, 1753-1921, DAR.1925.01, Darlington Collection, Archives & Special Collections, University of Pittsburgh Library System",,,Darlington Family Papers,,DAR.1925.01,,,"Darlington Family Papers\, 1753-1921\, DAR.1925.01\, Darlington Collection\, Special Collections Department\, University of Pittsburgh"
"Graduate School of Business Photobooks, 1967-2011",UA.90.17.2,"University Archives, Archives & Special Collections, University of Pittsburgh Library System","Graduate School of Business Photobooks, 1967-2011, UA.90.17.2, University Archives, Archives & Special Collections, University of Pittsburgh Library System",,,Graduate School of Business Photobooks,1973-2001,,UA.90.17.2,,
"Charles Henry Pace and Frankie M. Pace Gospel Music Collection, 1927-1958",CAM.PAC.1999.01,"Center for American Music, Archives & Special Collections, University of Pittsburgh Library System","Charles Henry Pace and Frankie M. Pace Gospel Music Collection, 1927-1958, CAM.PAC.1999.01, Center for American Music, Archives & Special Collections, University of Pittsburgh Library System",,,"Charles Henry Pace and Frankie W. Pace Gospel Music Collection\, 1927-1958",,CAM.PAC.1999.01,,,"Charles Henry Pace and Frankie W. Pace Gospel Music Collection\, 1927-1958\, CAM.PAC.1999.01\, Center for American Music\, University of Pittsburgh Library System"
"University of Pittsburgh Archives Photographs, ca. 1880-present",UA.Photos,"University Archives, Archives & Special Collections, University of Pittsburgh Library System","University of Pittsburgh Archives Photographs, ca. 1880-present, UA.Photos, University Archives, Archives & Special Collections, University of Pittsburgh Library System",,,"University of Pittsburgh Historic Photographs\, 1884-present",,UA.Personal.Files,,,"University of Pittsburgh Historic Photographs\, 1884-present\, University Archives\, Archives & Special Collections\, University of Pittsburgh Library System"
"Henry F. and Kate B. Hebley Collection of Soviet Lantern Slides, ca. 1930-1939",SC.2019.06,"Archives & Special Collections, University of Pittsburgh Library System","Henry F. and Kate B. Hebley Collection of Soviet Lantern Slides, ca. 1930-1939, SC.2019.06, Archives & Special Collections, University of Pittsburgh Library System",,,"Henry F. and Kate B. Hebley Collection of Soviet Lantern Slides\, ca. 1930-1939",,SC.2019.06,,,"Henry F. and Kate B. Hebley Collection of Soviet Lantern Slides\, ca. 1930-1939\, SC.2019.06\, Archives & Special Collections\, University of Pittsburgh Library System"
Pittsburgh Photographic Library Collection,CLP-PPL,Carnegie Library of Pittsburgh,"Pittsburgh Photographic Library Collection, CLP-PPL, Carnegie Library of Pittsburgh",,,Pittsburgh Photographic Library Collection,,CLP-PPL,,,"Pittsburgh Photographic Library\, Local History\, Archives and Special Collections\, Carnegie Library of Pittsburgh"
"Charles R. Martin Photographs, 1945-2011",AIS.2012.04,"Archives & Special Collections, University of Pittsburgh Library System","Charles R. Martin Photographs, 1945-2011, AIS.2012.04, Archives & Special Collections, University of Pittsburgh Library System",,,"Charles R. Martin Photographs\, 1968",,AIS.2012.04,,,"Charles R. Martin Photographs\, AIS.2012.04\, Archives & Special Collections\, University of Pittsburgh Library System"
"Frederick J. Osterling Collection, ca. 1888-1910",DAR.2014.01,"Darlington Collection, Archives & Special Collections, University of Pittsburgh Library System","Frederick J. Osterling Collection, ca. 1888-1910, DAR.2014.01, Darlington Collection, Archives & Special Collections, University of Pittsburgh Library System",,,"Frederick J. Osterling Collection\, ca. 1888-1910",,DAR.2014.01,,,"Frederick J. Osterling Collection\, ca. 1889-c1910\, DAR.2014.01\, Darlington Collection\, Archives & Special Collections\, University of Pittsburgh Library System"
"Smoke Control Lantern Slide Collection, ca. 1940-1950",AIS.1978.22,"Archives & Special Collections, University of Pittsburgh Library System","Smoke Control Lantern Slide Collection, ca. 1940-1950, AIS.1978.22, Archives & Special Collections, University of Pittsburgh Library System",,,"Smoke Control Lantern Slide Collection\, ca. 1940s-1950s",,AIS.1978.22,,,"Smoke Control Lantern Slide Collection\, ca. 1940s-1950s\, AIS.1978.22\, Archives & Special Collections\, University of Pittsburgh Library System"
Swedish Nationality Room Committee Records,UA.40.03,"University Archives, Archives & Special Collections, University of Pittsburgh Library System","Swedish Nationality Room Committee Records, UA.40.03, University Archives, Archives & Special Collections, University of Pittsburgh Library System",,,Swedish Nationality Room Committee Collection,,UA.1999.74,,,"Swedish Nationality Room Committee Collection\, UA.1999.74\, University Archives\, Archives & Special Collections\, University of Pittsburgh Library System"
"German Nationality Room Committee Records, 1927-1954",UA.40.09,"University Archives, Archives & Special Collections, University of Pittsburgh Library System","German Nationality Room Committee Records, 1927-1954, UA.40.09, University Archives, Archives & Special Collections, University of Pittsburgh Library System",,,"German Nationality Room Committee Collection\, 1927-1954",,UA.40.09,,,"German Nationality Room Committee Collection\, 1927-1954\, UA.40.09\, University Archives\, Archives & Special Collections\, University of Pittsburgh Library System"
"Hungarian Nationality Room Committee Records, 1926-1964",UA.40.11,"University Archives, Archives & Special Collections, University of Pittsburgh Library System","Hungarian Nationality Room Committee Records, 1926-1964, UA.40.11, University Archives, Archives & Special Collections, University of Pittsburgh Library System",,,"Hungarian Nationality Room Committee Collection\, 1926-1964",,UA.40.11,,,"Hungarian Nationality Room Committee Collection\, 1926-1964\, UA.40.11\, University Archives\, Archives & Special Collections\, University of Pittsburgh Library System"
"Lithuanian Nationality Room Committee Records, 1885-2000",UA.40.15,"University Archives, Archives & Special Collections, University of Pittsburgh Library System","Lithuanian Nationality Room Committee Records, 1885-2000, UA.40.15, University Archives, Archives & Special Collections, University of Pittsburgh Library System",,,"Lithuanian Nationality Room Committee Collection\, 1885-2000",,UA.40.15,,,"Lithuanian Nationality Room Committee Collection\, 1885-2000\, UA.40.15\, University Archives\, Archives & Special Collections\, University of Pittsburgh Library System"
"University of Pittsburgh Archives Personal Files, 1824-present",UA.Personal.Files,"University Archives, Archives & Special Collections, University of Pittsburgh Library System","University of Pittsburgh Archives Personal Files, 1824-present, UA.Personal.Files, University Archives, Archives & Special Collections, University of Pittsburgh Library System",,,University of Pittsburgh Archives Personal Files,,UA.Personal.Files,,,"University of Pittsburgh Archives Personal Files\, UA.Personal.Files\, University Archives\, Archives & Special Collections\, University of Pittsburgh Library System"
"James Patterson Ledger, 1815-1818",DAR.1937.13,"Darlington Collection, Archives & Special Collections, University of Pittsburgh Library System","James Patterson Ledger, 1815-1818, DAR.1937.13, Darlington Collection, Archives & Special Collections, University of Pittsburgh Library System",,,"James Patterson Ledger\, 1815-1818 DAR.1937.13",,DAR.1937.13,,,"James Patterson Ledger\, 1815-1818\, DAR.1937.13\, Darlington Collection\, Archives & Special Collections\, University of Pittsburgh Library System"
"Dr. Thomas E. Starzl M.D. Papers, 1908-2017",UA.90.F68,"University Archives, Archives & Special Collections, University of Pittsburgh Library System","Dr. Thomas E. Starzl M.D. Papers, 1908-2017, UA.90.F68, University Archives, Archives & Special Collections, University of Pittsburgh Library System",,,"Dr. Thomas E. Starzl M.D. Papers\, 1908-2017",,UA.90.F68,,,"Dr. Thomas E. Starzl M.D. Papers\, 1908-2017\, UA.90.F68\, University Archives\, Archives & Special Collections\, University of Pittsburgh Library System"
"Pittsburgh & Lake Erie Railroad Company Records, 1850-1999",AIS.1982.23,"Archives & Special Collections, University of Pittsburgh Library System","Pittsburgh & Lake Erie Railroad Company Records, 1850-1999, AIS.1982.23, Archives & Special Collections, University of Pittsburgh Library System",,,Pittsburgh & Lake Erie Railroad Company Records,,AIS.1982.23,,,"Pittsburgh & Lake Erie Railroad Company Records\, 1850-1999\, AIS.1982.23\, Archives & Special Collections\, University of Pittsburgh Library System"
"Homestead Album Oral History Project Records, 1975-1977",AIS.1980.06,"Archives & Special Collections, University of Pittsburgh Library System","Homestead Album Oral History Project Records, 1975-1977, AIS.1980.06, Archives & Special Collections, University of Pittsburgh Library System",,,"Homestead Album Oral History Project Records\, 1975-1977",,AIS.1986.06,,,"Homestead Album Oral History Project Records\, 1975-1977\, AIS.1980.06\, Archives & Special Collections\, University of Pittsburgh Library System"
"Kingsley Association Records, 1894-1980",AIS.1970.05,"Archives & Special Collections, University of Pittsburgh Library System","Kingsley Association Records, 1894-1980, AIS.1970.05, Archives & Special Collections, University of Pittsburgh Library System",,,Kingsley Association Records,,AIS.1970.05,,,"Kingsley Association Records\, 1894-1980\, AIS.1970.05\, Archives & Special Collections\, University of Pittsburgh Library System"
"Brashear Association Records, 1891-1978",AIS.1979.17,"Archives & Special Collections, University of Pittsburgh Library System","Brashear Association Records, 1891-1978, AIS.1979.17, Archives & Special Collections, University of Pittsburgh Library System",,,Brashear Association Records,,AIS.1979.17,,,"Brashear Association Records\, 1891-1978\, AIS.1979.17\, Archives & Special Collections\, University of Pittsburgh Library System"
"Pittsburgh Prints from the Collection of Wesley Pickard, ca. 1843-1982",AIS.2006.03,"Archives & Special Collections, University of Pittsburgh Library System","Pittsburgh Prints from the Collection of Wesley Pickard, ca. 1843-1982, AIS.2006.03, Archives & Special Collections, University of Pittsburgh Library System",,,"Pittsburgh Prints from the Collection of Wesley Pickard\, ca. 1843-1982",,AIS.2006.03,,,"Pittsburgh Prints from the Collection of Wesley Pickard\, ca. 1843-1982\, AIS.2006.03\, Archives & Special Collections\, University of Pittsburgh Library System"
"Lillian A. Friedberg Papers, 1904-1975",AIS.2000.04,"Archives & Special Collections, University of Pittsburgh Library System","Lillian A. Friedberg Papers, 1904-1975, AIS.2000.04, Archives & Special Collections, University of Pittsburgh Library System",,,"Papers of Lillian A. Friedberg\, 1904-1975",,AIS.2000.04,,,"Lillian A. Friedberg Papers\, 1904-1975\, AIS.2000.04\, Archives & Special Collections\, University of Pittsburgh Library System"
"Pennsylvania Railroad Photographs, 1907-1917",AIS.2012.03,"Archives & Special Collections, University of Pittsburgh Library System","Pennsylvania Railroad Photographs, 1907-1917, AIS.2012.03, Archives & Special Collections, University of Pittsburgh Library System",,,"Pennsylvania Railroad Photographs\, 1907-1917",,AIS.2012.03,,,"Pennsylvania Railroad Photographs\, 1907-1917\, AIS.2012.03\, Archives & Special Collections\, University of Pittsburgh Library System"
"Pennsylvania Railroad Locomotive Negative Collection, ca. 1935-1940",AIS.2014.03,"Archives & Special Collections, University of Pittsburgh Library System","Pennsylvania Railroad Locomotive Negative Collection, ca. 1935-1940, AIS.2014.03, Archives & Special Collections, University of Pittsburgh Library System",,,"Pennsylvania Railroad Locomotive Negative Collection\, ca. 1935-1940",,AIS.2014.03,,,"Pennsylvania Railroad Locomotive Negative Collection\, ca. 1935-1940\, AIS.2014.03\, Archives & Special Collections\, University of Pittsburgh Library System"
"Kuntu Repertory Theatre Records, 1974-2013",CTC.2015.01,"Curtis Theatre Collection, Archives & Special Collections, University of Pittsburgh Library System","Kuntu Repertory Theatre Records, 1974-2013, CTC.2015.01, Curtis Theatre Collection, Archives & Special Collections, University of Pittsburgh Library System",,,Kuntu Repertory Theatre Collection,,CTC.2015.01,,,"Kuntu Repertory Theatre Records\, 1974-2013\, CTC.2015.01\, Curtis Theatre Collection\, Archives & Special Collections\, University of Pittsburgh Library System"
"Center for Instructional Development and Distance Education (CIDDE), University of Pittsburgh, Photograph Collection, 1986-2005",UA.15.38.1,"University Archives, Archives & Special Collections, University of Pittsburgh Library System","Center for Instructional Development and Distance Education (CIDDE), University of Pittsburgh, Photograph Collection, 1986-2005, UA.15.38.1, University Archives, Archives & Special Collections, University of Pittsburgh Library System",,,"Center for Instructional Development and Distance Education (CIDDE)\, University of Pittsburgh\, Photograph Collection\, 1986-2005",,UA.15.38.1,,,"Center for Instructional Development and Distance Education (CIDDE)\, University of Pittsburgh\, Photograph Collection\, 1986-2005\, UA.15.38.1\, University Archives\, Archives & Special Collections\, University of Pittsburgh Library System"
"Irish Nationality Room Committee Records, 1928-2000",UA.40.12,"University Archives, Archives & Special Collections, University of Pittsburgh Library System","Irish Nationality Room Committee Records, 1928-2000, UA.40.12, University Archives, Archives & Special Collections, University of Pittsburgh Library System",,,Irish Nationality Room Committee Collection,,UA-40-12,,,"Irish Nationality Room Committee Records\, 1928-2000\, UA.40.12\, University Archives\, Archives & Special Collections\, University of Pittsburgh Library System"
"Romanian Nationality Room Committee Records, 1927-1953",UA.40.18,"University Archives, Archives & Special Collections, University of Pittsburgh Library System","Romanian Nationality Room Committee Records, 1927-1953, UA.40.18, University Archives, Archives & Special Collections, University of Pittsburgh Library System",,,"Romanian Nationality Room Committee Collection\, 1927-1953",,UA-40-18,,,"Romanian Nationality Room Committee Collection\, 1927-1953\, UA.40.18\, University Archives\, Archives & Special Collections\, University of Pittsburgh Library System"
"Norwegian Nationality Room Committee Records, 1928-2009",UA.40.16,"University Archives, Archives & Special Collections, University of Pittsburgh Library System","Norwegian Nationality Room Committee Records, 1928-2009, UA.40.16, University Archives, Archives & Special Collections, University of Pittsburgh Library System",,,"Romanian Nationality Room Committee Collection\, 1927-1953",,UA-40-16,,,"Norwegian Nationality Room Committee Collection\, 1928-2009\, UA.40.16\, University Archives\, Archives & Special Collections\, University of Pittsburgh Library System"
"Syria-Lebanon Nationality Room Committee Records, 1935-1941",UA.40.22,"University Archives, Archives & Special Collections, University of Pittsburgh Library System","Syria-Lebanon Nationality Room Committee Records, 1935-1941, UA.40.22, University Archives, Archives & Special Collections, University of Pittsburgh Library System",,,"Syria-Lebanon Nationality Room Committee Collection\, 1935-1941",,UA.40.22,,,"Syria-Lebanon Nationality Room Committee Collection\, 1935-1941\, UA.40.22\, University Archives\, Archives & Special Collections\, University of Pittsburgh Library System"
"French Nationality Room Committee Records, 1927-1956",UA.40.8,"University Archives, Archives & Special Collections, University of Pittsburgh Library System","French Nationality Room Committee Records, 1927-1956, UA.40.8, University Archives, Archives & Special Collections, University of Pittsburgh Library System",,,"French Nationality Room Committee Collection\, 1927-1956",,UA-40-8,,,"French Nationality Room Committee Collection\, 1927-1956\, UA.40.8\, University Archives\, Archives & Special Collections\, University of Pittsburgh Library System"
"Ukrainian Nationality Room Committee Records, 1973-2000",UA.40.23,"University Archives, Archives & Special Collections, University of Pittsburgh Library System","Ukrainian Nationality Room Committee Records, 1973-2000, UA.40.23, University Archives, Archives & Special Collections, University of Pittsburgh Library System",,,"Ukranian Nationality Room Committee Collection\, 1973-2000",,UA-40-23,,,"Ukranian Nationality Room Committee Collection\, 1973-2000\, UA.40.23\, University Archives\, Archives & Special Collections\, University of Pittsburgh Library System"
"English Nationality Room Committee Records, 1931-1981",UA.40.07,"University Archives, Archives & Special Collections, University of Pittsburgh Library System","English Nationality Room Committee Records, 1931-1981, UA.40.07, University Archives, Archives & Special Collections, University of Pittsburgh Library System",,,"English Nationality Room Committee Collection\, 1931-1981",,UA-40-07,,,"English Nationality Room Committee Collection\, 1931-1981\, UA.40.07\, University Archives\, Archives & Special Collections\, University of Pittsburgh Library System"
"Graduate School of Public Health Records, 1937-2018",UA.90.41,"University Archives, Archives & Special Collections, University of Pittsburgh Library System","Graduate School of Public Health Records, 1937-2018, UA.90.41, University Archives, Archives & Special Collections, University of Pittsburgh Library System",,,Graduate School of Public Health Records,,UA.90.41,,,"Graduate School of Public Health Records\, 1937-2018\, UA.90.41\, University Archives\, Archives & Special Collections\, University of Pittsburgh Library System"
"Graduate School of Public Health Records, 1937-2018",UA.90.41,"University Archives, Archives & Special Collections, University of Pittsburgh Library System","Graduate School of Public Health Records, 1937-2018, UA.90.41, University Archives, Archives & Special Collections, University of Pittsburgh Library System",,,Graduate School of Public Health Records,,UA.90.42,,,"Graduate School of Public Health Records\, 1937-2018\, UA.90.41\, University Archives\, Archives & Special Collections\, University of Pittsburgh Library System"
"Graduate School of Public Health Records, 1937-2018",UA.90.41,"University Archives, Archives & Special Collections, University of Pittsburgh Library System","Graduate School of Public Health Records, 1937-2018, UA.90.41, University Archives, Archives & Special Collections, University of Pittsburgh Library System",,,Graduate School of Public Health Records,,UA.90.43,,,"Graduate School of Public Health Records\, 1937-2018\, UA.90.41\, University Archives\, Archives & Special Collections\, University of Pittsburgh Library System"
"Graduate School of Public Health Records, 1937-2018",UA.90.41,"University Archives, Archives & Special Collections, University of Pittsburgh Library System","Graduate School of Public Health Records, 1937-2018, UA.90.41, University Archives, Archives & Special Collections, University of Pittsburgh Library System",,,Graduate School of Public Health Records,,UA.90.44,,,"Graduate School of Public Health Records\, 1937-2018\, UA.90.41\, University Archives\, Archives & Special Collections\, University of Pittsburgh Library System"
"Graduate School of Public Health Records, 1937-2018",UA.90.41,"University Archives, Archives & Special Collections, University of Pittsburgh Library System","Graduate School of Public Health Records, 1937-2018, UA.90.41, University Archives, Archives & Special Collections, University of Pittsburgh Library System",,,Graduate School of Public Health Records,,UA.90.45,,,"Graduate School of Public Health Records\, 1937-2018\, UA.90.41\, University Archives\, Archives & Special Collections\, University of Pittsburgh Library System"
"Graduate School of Public Health Records, 1937-2018",UA.90.41,"University Archives, Archives & Special Collections, University of Pittsburgh Library System","Graduate School of Public Health Records, 1937-2018, UA.90.41, University Archives, Archives & Special Collections, University of Pittsburgh Library System",,,Graduate School of Public Health Records,,UA.90.46,,,"Graduate School of Public Health Records\, 1937-2018\, UA.90.41\, University Archives\, Archives & Special Collections\, University of Pittsburgh Library System"
"Graduate School of Public Health Records, 1937-2018",UA.90.41,"University Archives, Archives & Special Collections, University of Pittsburgh Library System","Graduate School of Public Health Records, 1937-2018, UA.90.41, University Archives, Archives & Special Collections, University of Pittsburgh Library System",,,Graduate School of Public Health Records,,UA.90.47,,,"Graduate School of Public Health Records\, 1937-2018\, UA.90.41\, University Archives\, Archives & Special Collections\, University of Pittsburgh Library System"
"Graduate School of Public Health Records, 1937-2018",UA.90.41,"University Archives, Archives & Special Collections, University of Pittsburgh Library System","Graduate School of Public Health Records, 1937-2018, UA.90.41, University Archives, Archives & Special Collections, University of Pittsburgh Library System",,,Graduate School of Public Health Records,,UA.90.48,,,"Graduate School of Public Health Records\, 1937-2018\, UA.90.41\, University Archives\, Archives & Special Collections\, University of Pittsburgh Library System"
